{"$id":"https://harness.planeon.ai/schemas/v1alpha1/runtime/signed-admission-envelope.schema.json","$schema":"https://json-schema.org/draft/2020-12/schema","additionalProperties":false,"properties":{"apiVersion":{"$ref":"common.schema.json#/$defs/apiVersion"},"kind":{"const":"SignedAdmissionEnvelope"},"metadata":{"$ref":"common.schema.json#/$defs/metadata"},"payload":{"additionalProperties":false,"properties":{"admissionId":{"$ref":"common.schema.json#/$defs/stableId"},"budgetDigest":{"$ref":"common.schema.json#/$defs/sha256"},"expiresAt":{"$ref":"common.schema.json#/$defs/timestamp"},"idempotencyKeyDigest":{"$ref":"common.schema.json#/$defs/sha256"},"issuedAt":{"$ref":"common.schema.json#/$defs/timestamp"},"nonce":{"$ref":"common.schema.json#/$defs/nonce"},"notBefore":{"$ref":"common.schema.json#/$defs/timestamp"},"operation":{"enum":["MODEL_INFERENCE","AGENT_RUN","TOOL_EXECUTION","WORKFLOW_RESUME"]},"organizationId":{"$ref":"common.schema.json#/$defs/stableId"},"policyDigest":{"$ref":"common.schema.json#/$defs/sha256"},"releaseDigest":{"$ref":"common.schema.json#/$defs/sha256"},"requestDigest":{"$ref":"common.schema.json#/$defs/sha256"},"subjectDigest":{"$ref":"common.schema.json#/$defs/sha256"}},"required":["organizationId","admissionId","subjectDigest","releaseDigest","policyDigest","budgetDigest","requestDigest","operation","issuedAt","notBefore","expiresAt","nonce","idempotencyKeyDigest"],"type":"object"},"signature":{"allOf":[{"$ref":"common.schema.json#/$defs/signature"},{"properties":{"purpose":{"const":"RUNTIME_ADMISSION"}}}]}},"required":["apiVersion","kind","metadata","payload","signature"],"title":"SignedAdmissionEnvelope","type":"object"}
