{"apiVersion":"harness.planeon.ai/v1alpha1","kind":"SignedAdmissionEnvelope","metadata":{"id":"runtime.admission-001","version":"1.0.0"},"payload":{"admissionId":"runtime.admission-001","budgetDigest":"sha256:4444444444444444444444444444444444444444444444444444444444444444","expiresAt":"2030-02-01T00:05:00Z","idempotencyKeyDigest":"sha256:6666666666666666666666666666666666666666666666666666666666666666","issuedAt":"2030-02-01T00:00:00Z","nonce":"AAAAAAAAAAAAAAAAAAAAAA","notBefore":"2030-02-01T00:00:00Z","operation":"AGENT_RUN","organizationId":"acme.example","policyDigest":"sha256:3333333333333333333333333333333333333333333333333333333333333333","releaseDigest":"sha256:2222222222222222222222222222222222222222222222222222222222222222","requestDigest":"sha256:5555555555555555555555555555555555555555555555555555555555555555","subjectDigest":"sha256:1111111111111111111111111111111111111111111111111111111111111111"},"signature":{"algorithm":"ED25519","keyId":"test.ed25519-01","profile":"RFC8785_JCS_ED25519_V1","purpose":"RUNTIME_ADMISSION","signedMessageDigest":"sha256:12214b6e3b4f3885b5dfee40c810a51a2856d215712e3c66e5b270910f405c8d","value":"U1R29PR8m0-nUHk47QlZ0lKNBlCknQ-MKj8B9fwhE3gjdhEDpnIozRBd2iJq3hfi28k5deQ7WYtd7ENB2-XcBA"}}
